,ID,Title,Number of Views,Number of Likes,Number of Comments
0,d9MyW72ELq0,Avatar: The Way of Water | Official Trailer,58105015,1042812,43100
1,6pHZmBin4Xc,Toruk Macto - AVATAR (4k Movie Clip),2370890,18235,475
2,5PSNL1qE6VY,Avatar | Official Trailer (HD) | 20th Century FOX,12786252,81198,8937
3,nsO1isT60h8,Destruction of Home Tree - AVATAR (4k Movie Clip),470608,3723,605
4,0sJeBiUCIt4,AVATAR Clip - Final Battle (2009) James Cameron,32291907,191699,3683
5,a8Gx8wiNbs8,Avatar: The Way of Water | Official Teaser Trailer,27750489,682450,29027
6,YXtWPVFk5TQ,Avatar 3  Official Trailer | James Cameron  | 20th Century Studios | Avatar 3 Trailer,3177252,39094,1420
7,QohBlL3WurE,Training with the Ikran - AVATAR (4k Movie Clip),216686,2854,65
8,V67Ytgs6KJo,Avatar: First Movie RECAP,609220,10334,319
9,ZM2k1UmcCXg,"AVATAR Clip - ""Ikran"" (2009)",28515515,163631,2208
10,-pDP5K-xW2Y,Jake vs Colonel Quaritch - AVATAR (4k Movie Clip),820057,6963,421
11,Mvt1OWNk_Sg,The Final Battle (Part 1) - AVATAR (4k Movie Clip),500694,4965,208
12,oFErWcXJLdw,TRAINING TO BE IN THE NEXT AVATAR MOVIE,2527672,49508,1666
13,PLtgIILX7E8,AVATAR Full Movie 2023: Fallen Kingdom | Superhero FXL Action Movies 2023 in English (Game Movie),42239275,200118,1299
14,noVddIRzn3o,Sander VS Avatar Jake Sully #sandervs #satisfying #avatar,148497852,1151462,3278
15,mdhEj_rG80Y,AVATAR - Movie Behind the Scenes | Making of,2892002,8099,134
16,QOg9LUIvaig,"AVATAR: THE LAST AIRBENDER | Water, Earth, Fire, Air | Netflix",3250058,55052,3973
17,7wvY-Yxkyr8,*NEW* Netflix's Avatar Live Action Trailer Reaction + Breakdown,45172,2524,266
18,WDFr1O_GeAQ,Avatar (2009) - Best Scenes,2324621,17959,634
19,VjIdoK0xM5E,Neytiri and Jake vs Quaritch - Final Battle Scene - Avatar (2009) Movie Clip HD,1173381,4320,123
20,3G6J-ITWekA,Jake Wakes up in his Avatar Body - AVATAR (4k Movie Clip),5336584,23063,674
21,ofvrOdrO9gY,Neytiri saves Jake (Ending Scene) - AVATAR (4k Movie Clip),1278056,16743,855
22,2u9ApB0sWxw,"AVATAR RECAP: Everything You need to Know Before ""Way of Water""",579040,8994,322
23,HR2kbOK8i6I,The Last Airbender (2010) - Earthbenders Revolt! Scene (2/10) | Movieclips,10137909,78312,0
24,nxjOFZqtLJc,AVATAR 3 Official Trailer (2024) | 20th Century Studios | Disney+,1813518,21117,592
25,TgT8b62FJRI,Jake Meets Neytiri - AVATAR (4k Movie Clip),287067,3649,170
26,Xkw96oC3LnI,First Look at Team Avatar Movie Poster (2025),359317,31941,1183
27,zpSueMIfc2k,"AVATAR Clip - ""Awake"" (2009) James Cameron",13109366,54016,754
28,jbncrh_3NfM,The Final Battle (Part 3) - AVATAR (4k Movie Clip),562910,4790,199
29,Ehf6iESkLMk,Avatar 2: The Way Of Water - All Clips From The Movie (2022),2105017,10590,138
30,N_c8vTay6-k,Avatar 2 scenepack ‘child scenes’,395073,4466,144
31,nlAIdVotZfg,What a world this is! First time watching AVATAR movie reaction,191355,9225,640
32,u3_Uhq6qxhU,AVATAR: THE LAST AIRBENDER Official First Look (2024) Netflix Live Action Trailer,780669,6120,1075
33,RGx8rYbRVR4,Why People Hate Avatar: A Lesson In Lazy Commentary,426783,25778,4029
34,RCp5cMRiIfU,Avatar: The Last Airbender Official Teaser REACTION,39148,3708,430
35,kHNCaWjB-98,Zoe Saldana Performance Capture | AVATAR (2009) Before & After CGI #shorts,24082794,1020935,3182
36,n76KALvTN3Q,Avatar: The Way of Water (2022) - Lo'ak Rush to Save Payakan,1482072,4371,51
37,cN0kUKNBfxE,Avatar 2009 - The Final Battle - Best Fight Scenes FULL HD,3202214,27271,640
38,Cimy6T1nczw,Avatar Scenes Without CGI,16182227,120689,1634
39,U7cVZD0idBw,The Avatar wins a war with a Tsunami | The Last Airbender | CLIP,2372637,18251,731
40,TKndKigKkss,Avatar the Last Airbender movie coming 2024! #avatar #avatarthelastairbender #movie #nickelodeon,260073,16018,210
41,FZwm4D9DVSM,AVATAR: THE LAST AIRBENDER Trailer (2024),121541,2704,298
42,2r71I8lvTIA,The Last Airbender Film: How it Disrespected a Great Series (Avatar Video Essay),5113612,154651,27182
43,53ZP1nfx2u8,Avatar: The Way of Water (2022) - Metkayina Confront Humans to Rescue Kids,1166028,6043,168
44,0tpjNLKlatU,"In 2154, Humans Move To Moon With Species 3X Taller Than Them | AVATAR 1 RECAP",1119731,25788,1237
45,Mw192fc8LsQ,Lo'ak & Tsireya - The Way of Water,4854600,24959,258
46,rM8ogjwity8,Avatar: The Way of Water - How It Should Have Ended,1382900,74378,2382
47,p_GgAHd5siE,TOPH: An Avatar Fan Film,2198595,134607,5377
48,P6sv0RVV27Q,Avatar The Last Airbender Trailer 2024 Netflix Breakdown and Easter Eggs,734619,9519,766
49,3b7sKh_QIbQ,Avatar: The Last of the Airbenders - Part One | Fan Film | JNJ Studios,3516361,31294,798
